text,sentiment
mengantre - nya panjang . makanan sebenarnya biasa saja . nothing spesial . lebih enak jalan sedikit ke mi rica kejaksaan dekat braga .,positive
biadab,negative
"ketika akhir pekan , keluarga saya mengajak untuk makan siang di sini . ini pertama kali saya makan di sini . apalagi lokasi nya tidak jauh dari rumah saya . makanan nya sih menurut saya biasa saja . saya lebih memilih kiyadon ataupun sushi tei . tapi yang membuat saya terkesan adalah dekorasi meja nya . tampak personal sekali . tiap tempat makan disediakan origami kecil . lucu sekali bentuk nya",positive
kota kasablanka adalah salah satu mal yang berada di tebet .,neutral
king george menjadi presiden george .,neutral
rumah itu memiliki pagar besar berwarna hitam .,neutral
"0.5 % gips dapat memperkukuh struktus suatu bahan campuran , dan terakhir 0.25 % pupuk ts sebagai nutrisi .",neutral
"tenggak miras oplosan , dua pelajar di tasikmalaya tewas",neutral
penggemar yamien sama basooo . boleh lama ini di cobaaa ini yamien sama bakso nya tidak kalah sama yamien bakso yang lain-lain . sedepp,positive
"harapan kami anda sebagai pemimpin negeri ini . kekayaan yang kita miliki . akan kembali kepada rakyat , rakyat hidup makmur , nkri harga mati . kita rebut kembali kekayaan negeri ini yang telah jadi bancakan para penghianat dan penjual aset bangsa . bravo bung prabowo . insyaallah",neutral
kata nya pakai telkomsel banyak untung nya ternyata tidak untung sama sekali,negative
"mau marah deh sama indosat , parah anjing sinyal gue 3 hari tidak ada tiap dirumah",negative
sri mulyani tegur gubernur anies baswedan tentang perjalanan dinas pegawai : melalui,neutral
terima kasih pak jokowi sudah mau mampir ke kota tangerang dan menghadiri deklarasi calon legislatif perempuan untuk pemenangan jokowi - amin,positive
michelle kelihatannya langsung tidak suka sama kehadiran murid baru kinanti,negative
"baik kak , berkenan menunggu untuk kendala pada provider telkomsel akan direspon oleh rekan kami .",neutral
"suasana pedesaan terasa di sini , banyak tanaman padi dan anda bisa sewa sampan untuk berkeliling di danau buatan , hanya saja untuk makanan kurang enak dan agak mahal .",neutral
hebat,positive
gapake bukalapak kemarin waktu beli kaos kutang selusin,neutral
"hai jika barang yang diterima tidak sesuai silakan klik pengembalian barang ya , cek untuk panduan lengkap nya",neutral
tidak menyenangkan,negative
psis menang 3 - 2 di kandang psms medan,neutral
"sumpah , gue jadi ikutan goblok . eh . sebelum virus goblok semakin merasuk , saya mengaburkan diri dan terima kasih untuk . bos . gue enggak mau jadi ikutan goblok seperti yang sujud padahal kalah pilpres , gara-gara nonton tv oon ! foldedhands foldedhands winkingfacewithtongue foldedhands",negative
"gempar istri setnov pingsan , kpk bakal jerat keluarga setya novanto dengan kasus pencucian uang kamu : via",neutral
kafe ini pemandangan pemandangan kota bandung di waktu malam nya sangat bagus . luas . kerlap - kerlip lampu di kota bandung tampak ramai terlihat dari sini . sangat indah harga makanan di sini terbilang cenderung murah untuk standar kafe . rasa lumayan penyajian tidak terlalu lama .,positive
"ada rombongan touring apalah apalah , di jalan tol , pakai patwal nutup-nutup jalan mobil lain . payah ! touring kok pakai dikawal . cupu !",negative
gerindra alihkan rekomendasi ke agus an - tanri bali lamo : melalui,neutral
restoran raja sunda . makanan nya oke enaklah . kami sekeluarga pesan ayam goreng . gurame goreng dan usang galah bakar .,positive
semakin kamu membenci pak jokowi semakin kamu terlihat goblok !,negative
kalau pesan yang berbau keju . nanti pas datang pesanan piring itu seperti penuh dengan keju . mantaappp banget . karena setiap ke sini pesan nya pisang atau roti dengan berbagai toping dan pasti ada keju nya . saya coba juga nasi goreng nya . enak juga ternyata . mantaappp,positive
"letak nya memang agak di dalam . akses ke tempat ini jalan nya masih bebatuan , tapi bisa dilewati mobil . tempat ini didesain dengan bangunan khas jawa sehingga tempat ini terasa homey sekali . jika datang di hari minggu , akan ada live musik di sini . saya dan istri memesan nasi liwet dengan sate , rasanya enak . harga nya pun terjangkau .",positive
menyesal gua hemat hemat air di koran lu atas kegoblokan kamu pada,negative
"yue ke hotel yang di mongkok hongkong , tidak ada ! bulan juni lalu , saya booked dan sudah bayar untuk 2 kamar . tapi hotel tidak ditemukan",negative
"kafe ini cukup terkenal karena memang unik , tempat nya berkonsep seperti kayu-kayuan , makanan yang dijual pun tidak seperti kebanyakan tempat , ada bubur manado yang enak . harga nya juga cukup murah . kafe asi nya memang asik",positive
"kupat tahu gempol merupakan salah satu kupat tahu legendaris di kota bandung . tempat nya tidak terlalu besar tetapi cukup mencolok dengan warna merah nya di pertigaan pasar gempol . porsi nya pas banget untuk bunuh . ciri khas dari kupat tahu ini adalah tahu nya yang lembut dan kenyal serta kuah kacang nya pas di lidah , dipadu dengan lontong , tauge dan kerupuk merah . enak euy :",positive
"kios masakan oriental yang sederhana , tidak aneh-aneh , tetapi masakan nya sangat lezat dari zaman saya kuliah . meskipun tempat nya terhitung tidak besar , dekorasi nya unik , membuat kesan yang homy dan nostalgic . terakhir ke sini , saya mencoba lagi nasi hainan favorit saya . masih lezat . selain itu , sesuai nama nya , mi ayam di tempat ini juga mantap .. selain itu , tempat ini juga berposisi strategis ,",positive
"saya sering banget ke sini . makanan nya enak , harga nya terjangkau . menu favorit saya : udang bakar pedas dan tumis kangkung balasan rekomendasi . kepiting lada hitam nya juga lumayan enak .",positive
"itu maksud nya total 920 km , hasil dari pemerintahan sekarang ? ayolah pak jangan suka klaim sana sini , jangan suka menghilangkan sejarah bangsa . sejarah pribadi bolehlah bapak hilangkan . saya tidak yakin itu semua hanya karena bapak .",negative
"saya suka sekali atmosfer kampung daun . suasana hening ditimpali suara gemericik air terjun dan penerangan romantis dengan blencong dan lilin . meskipun jauh dari bandung tapi seimbanglah dengan suasana yang diinginkan . makanan nya enak , standar makanan sundalah . saya suka wedang ronde nya . malam-malam dingin bercengkerama sama keluarga ditemani wedang ronde dan pisang goreng . ada penampilan musik pada jam tertentu .",positive
malas,negative
"sengaja datang ke dusun bambu hanya untuk makan siang di burangrang restoran . suasana dalam restoran sangat menyenangkan karena kami berada di lantai 2 restoran . makanan nya pun sangat enak . rekomendasi soto bandung , pastel dan puding nya .",positive
"kursi banyak yang kotor , ac bocor , supir banyak berhenti tidak jelas , mengecewakan .",negative
kelihatan beliau ini ustad ilmu cetek .,negative
"angkat topi untuk anda , bung . saya salut . memang lama-lama isu pki ini bikin eneng , mau muntah . disuruh buktikan , tidak bisa . berkilah tingkat dewa . tetapi asik koar-koar terus pki bangkit , no pki , dan segala macam . mau bilang tidak senang sama pak de aza sampai berputar-putar bawa pki . pengecut .",negative
jual pembalut pergelangan tangan wrist band / wrist wrap - toko olahraga paser jaya tokopedia lewat,neutral
"tengok setya novanto di rutan kpk , deisti tumpangi mobil rheza",neutral
eci bukan bangsa indonesia ; eci adalah musuh pribumi dan muslim .,neutral
"baru di pekan lalu saya menemani seorang teman dari luar pulau jawa mengunjungi resto ini dan sengaja memilih menu dari bagian pastry - nya yaitu : pai ayam alias chicken pie . disajikan bersama saus sambal dan mustard , walau akhirnya saya minta saus tomat saja , pai ayam ini memang produk pasar - nya braga permai yang istimewa . rasanya enak karena daging ayam nya banyak , tekstur nya lembut .",positive
"kita jadi tahu , kemampuan ketua mpr plus ketum pan . ternyata setingkat anak sd , yang tidak bisa membedakan jobdeska nya . itu sungguh memalukan . partai penyebar isu bohong dan penolak uu ormas . 2019 mari kita tenggelamkan",negative
makan di tengah hutan dengan nuansa alam yang indah sekali . ditemani oleh suara gamelan sunda yang membuat kita sangat dekat dengan alam . tempat makan berupa saung saung traditional .,positive
"namun pagi ini saya lari pagi dengan sedikit kecewa , - ragunan sangat kotor , banyak sampah berserakan , sangat mengganggu pemandangan",negative
tidak tabah,negative
"aku sih tidak begitu tertarik dengan pertandingan nya . buat ku momen emosional nya justru pas diakhir . sedih saja melihat pemain-pemain liperpul nangis , kiper nya minta maaf sambil berlinang air mata . dia pasti menyesal sekali .",negative
"restoran yang romantis , bisa melihat pemandangan kota bandung yang bagus di malam hari . udara nya juga sejuk . makanan yang disediakan mulai dari masakan sunda sampai international . rasa makanan oke . harga tergolong mahal . penyajian makanan agak lama .",positive
"tempat favorit kami karena selain masakan yang lezat , pelayanan yang ramah , tempat nya pun nyaman . pemandangan yang indah , yang dapat membuat hati terhibur walau masih harus melanjutkan perjalanan yang jauh . untuk kantin , mungkin perlu ditambah barang barang kerajinan masyarakat setempat dan boleh diganti secara periodik supaya pengunjung bisa membeli kenangan-kenangan dari rumah makan ini .",positive
"tolong ya minimal , demi kemudahan nasabah agar di dalam stasiun tigaraksa diberikan mesin atm beserta iklan bank bni",neutral
"ejak berakhir nya orde baru yang dipimpin presiden suharto dan mulai nya periode reformasi , setiap pemilu di indonesia dianggap bebas dan adil .",neutral
"menyenangkan , makanan enak tapi ya pelayanan kurang , terlalu lama makanan yang dipesan , minuman juga enak enak",negative
"untuk yang kebingungan cari tempat makan waktu lagi kumpul bareng teman atau keluarga tapi punya selera yang berbeda2 , tempat ini direkomendasikan karena di sini menu nya lengkap . mulai dari makanan indonesia , makanan asia , westren makanan sampai yang bergaya eropa juga ada . turis mantan negara pun banyak yang berkunjung ke sini .",positive
"masakan di restoran ini , rasanya seperti melayang di udara dan bumbu nya selalu meresap di lidah . sangat luar biasa .",positive
"ditunggu saja , pasti dikasih . biasa maksimal seminggu kok",neutral
"memang kamu pikir ajaran kristen yang mengatakan orang-orang non kristen disebut domba sesat , itu tidak menghina ? coba deh sebelum kamu lompat pagar lebih jauh , cek dan analisa ajaran-ajaran kristen tersebut bukan hanya menghina , kristen juga memuat ajaran cabul yang tidak pantas disebut sebagai kitab suci",negative
tiba-tiba merasa tidak menyesal sama sekali plus bangga atas keputusan dan sikap yang sudah diambil karena tidak perlu lagi buang-buang waktu buat hal yang not even sepadan to di .,positive
"steak di sini cukup enak dengan wine yang mantap . udara sejuk , banyak pepohonan dan pemandangan yang luar biasa . kursi-kursi unik seperti di eropa zaman dahulu .",positive
"roti unyil , toko kue yang menyediakan berbagai macam roti / kue dengan ukuran cukup kecil , tetapi lezat sekali , sangat dikenal di bogor bandung",positive
"untuk makan sambil memanjakan mata dengan pemandangan yang indah dipakar kafe tempat nya menu makanan yang tersaji tidak jauh beda sih dengan kafe pada umum nya tetapi tempat nya ini yang bukan keren terletak di atas tebing teman hahhahaha mau makan saja harus perjuangan naik nya tetapi keren banget pemandangan nya , kalau mau datang pas tinggi season mending reservasi dulu biar tidak kena daftar tunggu .",positive
saya hanya membayangkan jika urban fpi hti berkuasa di negeri ini : legalitas bunuh bunuh bakar bakar terhadap yang tidak disukai akan jadi kenyataan .,negative
firdaus dukung suhartono calon wawli dari demokrat,neutral
jaksa enggan tanggapi soal jumlah uang diterima setya novanto,neutral
"di kopitiam oey braga ini kita dapat secara langsung melihat proses pengilingan biji kopi hingga menjadi bubuk kopi dan kita dapat memilih beberapa jenis kopi dengan aroma dan rasa yang berbeda , sangat cocok untuk oleh-oleh .",positive
masa ya harus datang ke gerai indosat dan komplain marah-marah di sana,negative
"waktu malam-malam sekitar pukul 24 saya ke sini untuk mencari makan . pelayanan cukup ramah , rasanya enak seperti di cabang kfc yang lain",positive
mobil toyota rush mengalami kecelakaan di ruas tol jomo jombang - mojokerto .,neutral
"sampai kapan pun saya tidak akan memilih orang pengecut seperti prabowo . menurut saya , dia tidak pantas memimpin negara .",negative
bagi penulis-penulis gpu yang berminat ikut serta dalam gerakan 4b bersama redaksi gpu pada tanggal 25 maret 2018 .,neutral
"ini kunjungan saya yang ketiga ke sapu lidi . maka saya akan memulai review saya dengan hal-hal yang perlu diperbaiki terlebih dahulu . saya dibesarkan dengan ajaran bahwa tempat / rumah seburuk apa pun harus memiliki kamar mandi / toilet yang bersih . terus terang , jika saya akan ke sapu lidi lagi , saya tidak akan menggunakan toilet nya . dinding toilet hanya ditutup semen , dan setengah terbuka sehingga beberapa hewan bisa masuk . saya jadi takut .",negative
"resto didesain menarik dan nyaman , makanan yang ditawarkan kebanyakan makanan nusantara . jika ingin mencoba soup buntut yang enak dengan tempat yang nyaman ya di sini . rasa dan harga sebanding , mantap dan oke",positive
dan akhirnya saya menyerah dengan indosat . paket internet yang kata nya murah tetapi hanya bisa bikin marah,negative
pernah percaya kalau body lotion citra bikin bulu tambah banyak,neutral
mobil terpopuler di uni emirat arab adalah toyota kijang innova yang sepenuh nya diproduksi di indonesia .,neutral
satu jerigen pengecer tembak 5000 perak bagimana bbm tidak langkah di tinambung polman . kacau ini,negative
aku memesan jaket gunung eiger,neutral
agaricpro merupakan produk herbal madu terfermentasi yang multikompleks khasiat nya karena merupakan kombinasi dari berbagai tumbuhan herbal,neutral
"rumah stroberi ini sangat luas dan enak buat nongkrong ramai-ramai sekeluarga . stroberi nya sih biasa saja ya . makanan juga standar sih tidak unik-unik amat . hanya enak saja tempat nya . bisa petik stoberi juga , hanya harus pesan dan pas lagi musim petik .",positive
seorang warga warakas mengaku menyesal pilih jokowi,negative
"saya mau tutup kartu kredit dari beberapa bulan lalu , nih .",neutral
"untuk yang suka pedas , pilih sambal domba . ayam bakar / goreng rempah nya enak . tahu yunyi bakar / goreng nya juga enak",positive
muka kayak cepot . di medan sudah ku matikan anak itu,negative
"hai , transaksi ini : 180604195019 sudah kami bantu remit , sedangkan transaksi ini : 170584351549 silakan kamu hubungi hubungan buka bantuan pada hubungan berikut .",neutral
fpi belum bubar ya . jika terus-terus buat rusa basmi majalah di nkri daripada pusing . kita ada penegak hukum,negative
dua mahasiswa unair tenggelam di pantai bantal,neutral
"saya mengikuuti lomba blog cinta rupiah bank indoneisa - net media dan sudah men - submit artikle pada 22 desember 2017 lalu , tapi sampai sekarang status artikel saya masih unpublished . mohon penjelasan nya .",neutral
jauhi narkoba adalah salah satu cara yang bisa digunakan untuk meningkatkan kualitas anak bangsa .,neutral
": dapatkan voucher pulsa rp 25.000 , - untuk dua orang yang beruntung setiap hari nya hanya dengan retweet bniquotes",neutral
menteri susi terima brevet kehormatan hiu kencana,neutral
"terletak di pusat kota , restoran ini hampir tidak pernah sepi pengunjung . saya sudah berkali-kali memilih tempat ini karena suasana yang sangat nyaman dan makanan yang enak . makanan yang paling saya suka di sini adalah grilled salmon nya . rekomendasi banget .",positive
"memang enggak enak terjebak macet , tapi lebih tidak enak lagi kalau terjebak masa lalu",negative
ya allah minggu ini masih harus lpm kenapa sudah ada feeling saja minggu ini akan terasa melelahkan,negative
"tidak bisa saya utarakan kebahagiaan saya saat ini , kemarin malam saya makan malam dengan seseorang yang sekarang sudah menjadi pacar saya , kita dekat lebih dari 4 tahun , dan baru tadi malam saya memberanikan diri untuk menyatakan nya . berkat pelayanan dan suasana dan juga bantuan mereka karyawan-karyawan the peak . pacar saya akhirnya menerima saya untuk jadi pacar nya . saya sangat merekondasikan tempat ini .",positive
demi apa pun gua ingin marah indosat cacat banget si,negative
"jika nantinya terdapat kendala lainnya dan ingin menanyakan seputar tokopedia , jangan sungkan menghubungi kami kembali .",neutral
pangeran hyang manda agung dari sancang,neutral
"rekan nya dibui , anggota fpi satroni mapolresta bekasi -",neutral
"senang sekali bisa petik stroberi sendiri , stroberi nya pun banyak dan matang . meski mahal , tetapi puas . : pelayan nya pun ramah dan baik . syarat untuk petik stroberi : harus beli paket makan untuk 4 orang , 130 ribu - ayam goreng nasi , 150 ribu - gurame goreng nasi stroberi yang dipetik bayar 10.000 / ons",positive
"makanan cina yang layak , porsi besar , staf cepat , tapi lambat dalam memasak , meskipun tamu tidak banyak . harga mahal . namun , mereka sangat menjaga kebersihan .",positive
"memiliki konsep restoran yang sesuai dengan nama nya , dengan cara meceritakan perkembangan jalan braga di setiap sudut tembok nya . restoran ini menyajikan menu-menu handalan khas bandung . buat lidah saya , makanan di sini sangat enak karena bumbu nya yang pas dan orisinil .",positive
susah payah selfie demi si samsung galaxy . yang penting usaha dan tetap bernyanyi,neutral
"cek apakah berlangganan konten tertentu dengan tekan 123 44 ya kak , jika butuh bantuan bisa mention tim juga ya",neutral
yuk ikutan kejutan retweet bniquotes berhadiah pulsa masing-masing . 25.000 untuk 2 orang pemenang setiap hari nya,neutral
"resto ini suasana nya cukup nyaman dengan layanan nya yang baik . tersedia berbagai menu masakan seafood berbahan dasar kepiting , udang , kerang , bawal dan kerapu . udang goreng mentega rasanya enak dan mantap . udang asam manis rasanya manis dan segar . kepiting saus singapore rasanya sangat mantap . rata-rata masakan nya enak dan mantap .",positive
saya sudah punya kode akses dan pin,neutral
macet bet bikin pusing,negative
makmur,positive
"meski baru pertama kali terjun ke piala dunia , traveloka berani menjadi satu-satunya sponsor dari indonesia pada piala dunia 2018 di rusia .",positive
"ah payah banget manchester city bisa kalah begitu dikandang -- memang tim cupu liga champions . diliga doang jago , memalukan inggris saja .",negative
banyak tingkah anjing . kesal saya melihat nya,negative
aduh sangat memalukan . mengaku umat islam tapi yang keluar dari mulut nya kotoran ! ini gara-gara faham new khawarij yang sudah menyelusup ke sebagian umat islam kalangan yang kurang ilmu .,negative
"restoran kedai nyonya rumah berada di tengah kota , tidak jauh dari jalan riau . sehingga bagi yang berkunjung ke jalan riau setelah lelah shoping , bisa mampir mencoba makanan di sini .",positive
"saya sarankan ke teman-teman , daripada tim pun pelayanan pelanggan lewat 185 / 186 , prefer ke sini saja lebih cepat .",neutral
putin sarankan rusia dan jepang sepakati perjanjian damai,neutral
"menyakitkan adalah ketika gue cemburu sama lo , tapi gue cuma bisa mendem . :",negative
"sebusuk-busuk nya pemimpin yang beragama islam , itu lebih layak dan lebih pantas daripada pemimpin non islam .",negative
"gerindra , partai pki zaman sekarang . pendana mca atau saracen . pemecah nkri . jualan agama dan mayat walau ketum nya tidak bisa ngaji . muslim kah ?",negative
calon pelamar cpns hanya dapat mendaftar di 1 instansi dan 1 formasi jabatan,neutral
restoran sunda yang memiliki konsep makan di sawah . pemandangan nya seperti di desa . makanan nya enak,positive
aku mau cemburu juga sapu nya hak,negative
"resto makanan barat dengan harga kaki lima , ditambah pemandangan alam yang indah , suasana yang romantis , asal jangan hujan , karena di teras dibiarkan terbuka . resto favorit keluarga saya .",positive
semenjak jokowidodo pki anak keturunan anjing ini menjadi presiden . semakin banyak cina-cina anjing komunis itu memasuk narkoba ke dalam nkri . dasar mamak dan isteri kau pelacur pki anjing,negative
"menang di pulau jawa , ppp yakin suara nya di 2019 terdongkrak",neutral
aku bangga net tv selalu menghadirkan program-program tv yang berkualitas,positive
"lokasi nya berada di pvj tepat nya di dekat fitness celebrity . seperti calais pada umum nya , tempat nya bersih dengan desain alan - ala kafe . favorit saya di sini adalah bule yang meletus-letus .",positive
"kami sekeluarga kalau ke bandung pasti selalu menyempatkan diri untuk makan di kampung daun , meskipun kadang menunggu lift nya lama kami tetap ingin menikmati makanan di kampung daun . menu andalan kami di sini ayam bakar dan nasi bakar , wedang jahe , pisang goreng coklat keju , sayur asam banyak lagi sih yang enak di sini .",positive
"ahmad dhani suka-suka - an ikut-ikut politik , mengerti juga tidak .",negative
"terima kasih atas jasa nya , saya sangat puas , pelayanan nya sangat baik dan ramah , pendamping nya juga keren , menyenangkan .",positive
. pokok nya kurang kurang afdol kalau ke lembang atau ke bandung tidak mampir ke sini . 4 humas naik buat kampung daun .,positive
menyesal beli first press regular karena isi photobooka nya alur seperti jodoh,negative
"saya datang ke sini karena penasaran melihat beberapa ulasan dari trip advisor . pelayanan nya baik dan ramah . mereka cepat tanggap saat kami memerlukan . namun sangat disayangkan kenapa makanan nya lama sekali datang , setelah setengah jam kemudian makanan yang kami order baru datang , untuk minuman datang nya malah setelah makanan datang duluan . harus nya kan minuman nya dulu .",negative
"untuk perihal pergantian rekening untuk pembayaran autodebet bpjs , bpk luqman bisa datang ke kantor cbg bank mandiri pengajuan autodebet tersebut ya untuk dapat dilakukan pemberhentian terlebih dahulu .",neutral
"bisa melihat bandung dari sini . pemandangan nya benar-benar juara . makanan nya jempol 4 tangan sama kaki , jadi enak dan so deliciosooo",positive
aku suka nasi goreng . setiap hari makan nasi goreng aku tidak akan bosan,positive
"silakan ku njungi kedai kita buat yang kemarin cari handphone advan , xiaomi redmi 4a dan nokia 150",neutral
mati lho ahli zon munafik kau . maka dari itu jangan sok bersih . kau sudah tidak ada harga nya di mata rakyat banyak mengoceh macam burung ku kelaparan,negative
"ini satu-satunya tempat makan masakan padang yang mantap ! tidak ada dua nya . di padang asli nya pun tetap kalah sama bu mus . juara ! favorit keluarga . buat saya semua macam masakan nya memiliki khas masing-masing . bahan , rasa , dan pengolahan semua lewat ! . tidak bosan deh makan di sini .",positive
toko kami menjual ikea tokig pengering sayuran - salad spinner - magic Jakarta,neutral
"ada yang minat album winter exo ? 215k masih sealed 1st press , dapat 2 poster , dan dapat limited postcard dari dengan . minat pesan langsung aku ya hehehe foldedhands",neutral
paris van java tempat cuci mata yang menyenangkan banyak toko-toko di sini mau cari apa saja ada di sini . setelah lelah kita bisa menikmati makanan di restoran yang banyak tersebar di pvj . tempat nya enak untuk bersantai dengan keluarga,positive
jutek banget deh karyawan indosat yang di graha indosat,negative
suasana perbukitan yang segar ditambah varian hidangan yang enak memang pas dinikmati di udara terbuka . pelayanan nya juga ramah .,positive
"hati-hati , ini adalah trik mereka untuk menutupi korupsi mereka .",negative
sudah pernah ikutan lelang di dan pernah menang . barang nya memang bagus sih gila . salut sama admin nya,positive
"ya itu mbak , mie nya itu kelembekan , aneh rasanya",negative
tolong dicarikan driver baru triliun - gr12290397000,neutral
creamy cheese pizza nya enak . tiramissunyaa juara dicoba ! harga nya lumayan terjangkau karena dekat kampus mungkin .,positive
baik terima kasih banyak,neutral
kasau terima kunjungan dirut bni di mabesau,neutral
"batagor kingsley batagor paling enak di bandung . apalagi kuah nya yang sangat lembut dan hangat . seporsi tidak cukup , perlu dua porsi . rasa ikan nya sangat kuat dan cukup mengenyangkan sebagai menu utama makan siang , jadi tidak masuk kategori cemilan .",positive
kali ini cukup belanja rp . 60 ribu di homecarealfamart bisa tebus minyak goreng cuma gopek,neutral
dapatkan hardisk dengan harga promo untuk setiap pemesanan jasa isi hardisk penuh 1 tb,neutral
jangan tertipu pencitraan pak jokowi dengan tidak mau tanda tangan uu md3,negative
jual stiker kompor 2 tungku hello kitty,neutral
aku buka grab . tidak ada satu pun grab driver yang online karena tengah malam .,neutral
"makanan nya enak , pemandangan dari restoran juga sangat bagus , udara nya sejuk sekali , bagus pelayanan . cocok untuk santai pada saat sore hari .",positive
"nyaman , bersih , makanan yang enak , dan sejuk ! saung-saung yang nyaman lengkap dengan bantal dan guling , suara air mengalir juga alunan musik sunda . selain tempat dan makanan yang enak , yang berkesan dari tempat ini adalah petugas toilet yang sangat ramah . :",positive
makan di sini jangan pas makan siang . antre nya . makan pakai piring seng . ada kue balok minuman makanan zaman dulu juga ada . rute makanan standar sih . standar banget .,negative
"banyak sekali warung makan di kota bandung , namun , warung ibu imas ini memiliki ciri khas yang tiada dua nya , yaitu sambal nya yang luar biasa pedas . bagi lidah orang sumatera atau minang cocok banget untuk dicoba , warung ibu imas menyajikan berbagai macam lauk pauk yang bisa di santap dengan harga yang relatif terjangkau .",positive
"jual aneka minuman dan jus juga . favorit aku sih beli jus pisang , jus pisang nya dicampur pakai susu coklat kental manis begitu , jadi lebih enak .",positive
